{
  "$schema": "https://json-schema.org/draft/2020-12/schema",
  "$id": "https://vulcano.ai/schemas/run.v1.json",
  "title": "Run Snapshot v1",
  "type": "object",
  "required": ["articles", "count", "timestamp"],
  "properties": {
    "version": { "type": "string", "default": "v1.0" },
    "articles": { "type": "array", "items": { "$ref": "article.v1.json" } },
    "count": { "type": "integer", "minimum": 0 },
    "timestamp": { "type": "string", "format": "date-time" },
    "params": { "type": "object", "additionalProperties": true }
  },
  "additionalProperties": true
}

