{
  "version": "v1.0",
  "articles": [
    {
      "id": "https://www.nacion.com/economia/negocios/costa-rica-promueve-digitalizacion-pymes/7Y2K3J4X5BHRNIOQMLPV5R6Z4A/story/",
      "title": "Costa Rica promueve la digitalización de pequeñas empresas",
      "summary": "El gobierno costarricense lanza un programa para apoyar a las pymes en la adopción de herramientas digitales, con el objetivo de aumentar su competitividad.",
      "url": "https://www.nacion.com/economia/negocios/costa-rica-promueve-digitalizacion-pymes/7Y2K3J4X5BHRNIOQMLPV5R6Z4A/story/",
      "source": "La Nación Costa Rica",
      "source_url": "https://www.nacion.com",
      "country": "Costa Rica",
      "topics": [
        "Tecnología",
        "Pymes"
      ],
      "language": "es",
      "published_at": "2023-10-05T21:00:00Z",
      "relevance": 7,
      "sentiment": "positive",
      "author": "Laura Sánchez",
      "curator": "Luciano AI"
    },
    {
      "id": "https://www.abc.com.py/nacionales/2023/10/05/paraguay-aprueba-ley-ciberseguridad-nacional/",
      "title": "Paraguay aprueba ley para fomentar la ciberseguridad nacional",
      "summary": "El Congreso paraguayo ratifica una normativa destinada a proteger las infraestructuras críticas del país frente a ciberataques, un tema prioritario en la región.",
      "url": "https://www.abc.com.py/nacionales/2023/10/05/paraguay-aprueba-ley-ciberseguridad-nacional/",
      "source": "ABC Color",
      "source_url": "https://www.abc.com.py",
      "country": "Paraguay",
      "topics": [
        "Regulación",
        "Ciberseguridad"
      ],
      "language": "es",
      "published_at": "2023-10-05T19:30:00Z",
      "relevance": 8,
      "sentiment": "neutral",
      "author": "Miguel Gómez",
      "curator": "Luciano AI"
    },
    {
      "id": "https://www.excelsior.com.mx/nacional/startup-mexicana-salud-digital-inversion-2023/1612345",
      "title": "Startup mexicana de salud digital cierra ronda de inversión",
      "summary": "Una empresa mexicana enfocada en telemedicina y soluciones de salud digital logra captar 3 millones de dólares para expandir sus servicios en el país.",
      "url": "https://www.excelsior.com.mx/nacional/startup-mexicana-salud-digital-inversion-2023/1612345",
      "source": "Excélsior",
      "source_url": "https://www.excelsior.com.mx",
      "country": "México",
      "topics": [
        "Startups",
        "Salud Digital"
      ],
      "language": "es",
      "published_at": "2023-10-05T17:15:00Z",
      "relevance": 7,
      "sentiment": "positive",
      "author": "Claudia Ramírez",
      "curator": "Luciano AI"
    }
  ],
  "count": 3,
  "timestamp": "2025-09-13T03:24:02.131Z",
  "params": {}
}