{
  "version": "v1.0",
  "articles": [
    {
      "id": "https://www.eluniversal.com.mx/cartera/mexico-aprueba-nueva-regulacion-para-fintechs",
      "title": "México aprueba nueva regulación para fintechs en el sector financiero",
      "summary": "El gobierno mexicano ha anunciado una serie de reformas para regular el crecimiento de las fintechs, buscando mayor transparencia y protección al consumidor en el sector de tecnología financiera.",
      "url": "https://www.eluniversal.com.mx/cartera/mexico-aprueba-nueva-regulacion-para-fintechs",
      "source": "El Universal",
      "source_url": "https://www.eluniversal.com.mx",
      "country": "México",
      "topics": [
        "Regulación",
        "Fintech"
      ],
      "language": "es",
      "published_at": "2023-10-05T14:30:00Z",
      "relevance": 8,
      "sentiment": "neutral",
      "author": "Juan Pérez",
      "curator": "Luciano AI"
    },
    {
      "id": "https://www.eltiempo.com/economia/empresas/startup-colombiana-de-logistica-recauda-10-millones-789123",
      "title": "Startup colombiana de logística recauda $10 millones en ronda Serie A",
      "summary": "Una startup de logística basada en Bogotá ha logrado captar $10 millones en una ronda de inversión Serie A, con el objetivo de expandirse a otros países de América Latina.",
      "url": "https://www.eltiempo.com/economia/empresas/startup-colombiana-de-logistica-recauda-10-millones-789123",
      "source": "El Tiempo",
      "source_url": "https://www.eltiempo.com",
      "country": "Colombia",
      "topics": [
        "Startups",
        "Inversión"
      ],
      "language": "es",
      "published_at": "2023-10-05T12:15:00Z",
      "relevance": 7,
      "sentiment": "positive",
      "author": "María Gómez",
      "curator": "Luciano AI"
    },
    {
      "id": "https://g1.globo.com/economia/noticia/2023/10/05/brasil-ley-streaming-contenido-local.ghtml",
      "title": "Brasil impulsa ley para regular plataformas de streaming",
      "summary": "El Congreso brasileño debate una nueva ley que obligaría a las plataformas de streaming a incluir un porcentaje de contenido local en sus catálogos.",
      "url": "https://g1.globo.com/economia/noticia/2023/10/05/brasil-ley-streaming-contenido-local.ghtml",
      "source": "G1 Globo",
      "source_url": "https://g1.globo.com",
      "country": "Brasil",
      "topics": [
        "Regulación",
        "Tecnología"
      ],
      "language": "pt",
      "published_at": "2023-10-05T10:45:00Z",
      "relevance": 6,
      "sentiment": "neutral",
      "author": "Carlos Silva",
      "curator": "Luciano AI"
    }
  ],
  "count": 3,
  "timestamp": "2025-09-13T19:00:57.252Z",
  "params": {}
}