{
  "version": "v1.0",
  "articles": [
    {
      "id": "https://www.eluniversal.com.mx/techbit/mexico-propone-ley-para-regular-criptomonedas",
      "title": "México avanza en regulación de criptomonedas con nueva propuesta de ley",
      "summary": "El Congreso mexicano presentó un proyecto de ley para regular el uso de criptomonedas y blockchain, buscando fomentar la innovación y proteger a los usuarios.",
      "url": "https://www.eluniversal.com.mx/techbit/mexico-propone-ley-para-regular-criptomonedas",
      "source": "El Universal",
      "source_url": "https://www.eluniversal.com.mx",
      "country": "México",
      "topics": [
        "Regulación",
        "Criptomonedas",
        "Tecnología"
      ],
      "language": "es",
      "published_at": "2023-10-25T14:30:00Z",
      "relevance": 8,
      "sentiment": "neutral",
      "author": "Juan Pérez",
      "curator": "Luciano AI"
    },
    {
      "id": "https://www.larepublica.co/empresas/startup-fintechcol-recibe-inversion-de-5-millones-2023",
      "title": "Startup colombiana de fintech recibe inversión de 5 millones de dólares",
      "summary": "La empresa bogotana FinTechCol logra cerrar una ronda de inversión Serie A para expandir sus servicios de pagos digitales en América Latina.",
      "url": "https://www.larepublica.co/empresas/startup-fintechcol-recibe-inversion-de-5-millones-2023",
      "source": "La República",
      "source_url": "https://www.larepublica.co",
      "country": "Colombia",
      "topics": [
        "Startups",
        "Fintech",
        "Inversión"
      ],
      "language": "es",
      "published_at": "2023-10-25T16:00:00Z",
      "relevance": 7,
      "sentiment": "positive",
      "author": "María Gómez",
      "curator": "Luciano AI"
    },
    {
      "id": "https://g1.globo.com/economia/noticia/2023/10/25/brasil-lanca-programa-de-incentivos-para-startups.ghtml",
      "title": "Brasil implementa nuevas políticas para startups tecnológicas",
      "summary": "El gobierno brasileño lanza un programa de incentivos fiscales para startups tecnológicas, con el objetivo de fortalecer el ecosistema de innovación.",
      "url": "https://g1.globo.com/economia/noticia/2023/10/25/brasil-lanca-programa-de-incentivos-para-startups.ghtml",
      "source": "G1 Globo",
      "source_url": "https://g1.globo.com",
      "country": "Brasil",
      "topics": [
        "Startups",
        "Regulación",
        "Tecnología"
      ],
      "language": "pt",
      "published_at": "2023-10-25T12:15:00Z",
      "relevance": 9,
      "sentiment": "positive",
      "author": "Ana Silva",
      "curator": "Luciano AI"
    }
  ],
  "count": 3,
  "timestamp": "2025-09-14T10:00:57.135Z",
  "params": {}
}