{
  "version": "v1.0",
  "articles": [
    {
      "id": "https://www.eluniversal.com.mx/tecnologia/mexico-aprueba-regulacion-para-plataformas-digitales",
      "title": "México aprueba nueva regulación para plataformas digitales",
      "summary": "El gobierno mexicano ha implementado una nueva normativa que exige a las plataformas digitales cumplir con estándares de transparencia y protección de datos para operar en el país.",
      "url": "https://www.eluniversal.com.mx/tecnologia/mexico-aprueba-regulacion-para-plataformas-digitales",
      "source": "El Universal",
      "source_url": "https://www.eluniversal.com.mx",
      "country": "México",
      "topics": [
        "Regulación",
        "Tecnología"
      ],
      "language": "es",
      "published_at": "2023-10-05T14:30:00Z",
      "relevance": 8,
      "sentiment": "neutral",
      "author": "Juan Pérez",
      "curator": "Valentina AI"
    },
    {
      "id": "https://www.eltiempo.com/economia/empresas/startup-colombiana-de-fintech-recibe-inversion-millonaria-123456",
      "title": "Startup colombiana de fintech recibe inversión millonaria",
      "summary": "Una startup de tecnología financiera en Colombia ha asegurado una ronda de financiación de 5 millones de dólares para expandir sus operaciones en América Latina.",
      "url": "https://www.eltiempo.com/economia/empresas/startup-colombiana-de-fintech-recibe-inversion-millonaria-123456",
      "source": "El Tiempo",
      "source_url": "https://www.eltiempo.com",
      "country": "Colombia",
      "topics": [
        "Startups",
        "Fintech"
      ],
      "language": "es",
      "published_at": "2023-10-05T16:45:00Z",
      "relevance": 7,
      "sentiment": "positive",
      "author": "María Gómez",
      "curator": "Valentina AI"
    },
    {
      "id": "https://www.bbc.com/mundo/noticias-america-latina-ia-crecimiento-2023",
      "title": "Crecimiento de la inteligencia artificial en América Latina",
      "summary": "Un informe regional destaca cómo la inteligencia artificial está transformando industrias clave en América Latina, con un enfoque en Brasil y México.",
      "url": "https://www.bbc.com/mundo/noticias-america-latina-ia-crecimiento-2023",
      "source": "BBC Mundo",
      "source_url": "https://www.bbc.com/mundo",
      "country": "Regional",
      "topics": [
        "Inteligencia Artificial",
        "Tecnología"
      ],
      "language": "es",
      "published_at": "2023-10-05T12:00:00Z",
      "relevance": 9,
      "sentiment": "positive",
      "author": "Ana Rodríguez",
      "curator": "Valentina AI"
    }
  ],
  "count": 3,
  "timestamp": "2025-09-14T20:00:59.614Z",
  "params": {}
}