{
  "articles": [
    {
      "id": "https://elcomercio.pe/economia/peru-tecnologias-verdes-mineria-2023/",
      "title": "Perú impulsa la adopción de tecnologías verdes en la industria minera",
      "summary": "El gobierno peruano ha anunciado incentivos para que las empresas mineras implementen tecnologías sostenibles, buscando reducir el impacto ambiental del sector.",
      "url": "https://elcomercio.pe/economia/peru-tecnologias-verdes-mineria-2023/",
      "source": "El Comercio",
      "source_url": "https://elcomercio.pe",
      "country": "Perú",
      "topics": [
        "Tecnología",
        "Sostenibilidad"
      ],
      "language": "es",
      "published_at": "2023-10-06T01:00:00Z",
      "relevance": 7,
      "sentiment": "positive",
      "author": "Sofía Vargas",
      "curator": "Luciano AI"
    },
    {
      "id": "https://www.lanacion.com.ar/economia/argentina-regulacion-fintechs-desafios-2023-nid05102023/",
      "title": "Argentina enfrenta desafíos en la regulación de fintechs",
      "summary": "Expertos advierten que la falta de un marco regulatorio claro para las fintechs en Argentina podría limitar su crecimiento y generar riesgos para los usuarios.",
      "url": "https://www.lanacion.com.ar/economia/argentina-regulacion-fintechs-desafios-2023-nid05102023/",
      "source": "La Nación",
      "source_url": "https://www.lanacion.com.ar",
      "country": "Argentina",
      "topics": [
        "Regulación",
        "Fintech"
      ],
      "language": "es",
      "published_at": "2023-10-06T00:30:00Z",
      "relevance": 6,
      "sentiment": "negative",
      "author": "Martín Rojas",
      "curator": "Luciano AI"
    },
    {
      "id": "https://www.la-razon.com/tecnologia/bolivia-capacitacion-programacion-jovenes-2023/",
      "title": "Bolivia lanza programa de capacitación en programación para jóvenes",
      "summary": "Con el apoyo de organismos internacionales, Bolivia ha iniciado un programa gratuito de formación en programación y desarrollo de software dirigido a jóvenes de zonas rurales.",
      "url": "https://www.la-razon.com/tecnologia/bolivia-capacitacion-programacion-jovenes-2023/",
      "source": "La Razón",
      "source_url": "https://www.la-razon.com",
      "country": "Bolivia",
      "topics": [
        "Educación",
        "Tecnología"
      ],
      "language": "es",
      "published_at": "2023-10-05T23:15:00Z",
      "relevance": 7,
      "sentiment": "positive",
      "author": "Claudia Gómez",
      "curator": "Luciano AI"
    }
  ],
  "count": 3,
  "timestamp": "2025-09-13T00:58:09.704Z",
  "params": {}
}